{
  "evidence_id": "NF-EVID-002",
  "study_type": "human_clinical",
  "source_kind": "peer_reviewed_article",
  "publication_date": "2025-04-16",
  "reviewer": "independent_desk_review; human adjudication pending",
  "evidence_level": "clinical_investigational",
  "source_provenance": {
    "source_url": "https://www.nature.com/articles/s41586-025-08700-0",
    "retrieved_on": "2026-09-15",
    "license_or_consent_basis": "public_article_metadata_only; no participant-level data copied",
    "dataset_or_model_version": "Nature 641, 971-977 (2025); DOI:10.1038/s41586-025-08700-0"
  },
  "disease_context": "parkinson_disease",
  "endpoint": "Primary safety/adverse-event assessment and secondary motor and dopamine-production outcomes through 24 months.",
  "model_limitations": [
    "Single-centre, investigator-initiated, open-label Phase I/II study without a control group.",
    "Seven participants contributed to safety assessment and six to efficacy assessment.",
    "The cell product and transplant context are specific to this study and cannot stand for other products."
  ],
  "uncertainty": [
    "Motor outcomes are secondary in a small uncontrolled study and remain exploratory.",
    "Long-term durability, disease modification, and transferability are not established."
  ],
  "negative_or_conflicting_evidence": [
    "The paper reports 73 adverse events: 72 mild and one moderate dyskinesia event; no serious adverse events were reported.",
    "Motor improvement was not uniform across participants, and the design cannot separate treatment effects from placebo or observer effects."
  ],
  "transferability_limits": [
    "Does not establish efficacy or clinical readiness for Parkinson disease cell replacement as a class.",
    "Does not establish disease modification or safety for other cell sources, products, doses, or transplantation methods."
  ],
  "conflict_of_interest": "Consult the article disclosure; not independently adjudicated in this record."
}
